headline,link,content,category
Microplastics are choking our waters. Could a sponge made of squid bones help remove them?,https://www.cnn.com/2024/12/17/science/microplastics-sponge-wuhan-china-scn-intl-hnk/,"Microplastics are everywhere. They have been found on thepeak of Mount Everestand in creaturesinhabiting the deepest trenches of the sea. They’re inbottled water,human placentasandbreast milk. These tiny plastic particles choke wildlife, disrupt ecosystems, and threaten human health – and they are notoriously difficult to remove. But scientists in China have come up with a possible solution: a biodegradable sponge made of squid bones and cotton. A research team from Wuhan University used chitin from squid bones and cellulose from cotton – two organic compounds known for eliminating pollution from wastewater – to create a biodegradable sponge. They then tested the sponge in four different water samples, taken from irrigation water, pond water, lake water and sea water, and found it removed up to 99.9% of microplastics, according to astudy published last month in Science Advances. “The planet is under great threat from microplastics, and aquatic ecosystems are the first to suffer,” wrote the authors. “Even under a variety of policies, including plastic product reduction, waste management, and environmental recycling, microplastic pollution is irreversible and escalating.” Microplastics are tiny shards of plastic smaller than 5 millimeters. They come from everything from tires, which are then broken down into smaller pieces, to microbeads, a plastic found in beauty products such as exfoliants. One study from 2020 estimated there are14 million metric tons of microplastics sitting on the ocean floor. Scientistshave calledmicroplastics “one of this generation’s key environmental challenges” and the problem is aninternationally recognizedenvironmental issue. Plastic is a persistent pollution that hurts wildlife, the ocean itself and there’sgrowing concernabout the potential health risks it poses to humans. The problem is only set to get worse with plastic production and pollutionexpected to increasein the coming years. Even if we embarked on an immediate and globally coordinated effort to reduce plastic consumption, anestimated 710 million metric tonsof plastic would still pollute the environment by 2040, according to another study. That makes finding solutions to get rid of the plastics contaminating our oceans all the more urgent. The sponge created by the Wuhan researchers was able to absorb microplastics both by physically intercepting them and through electromagnetic attraction, the study said. Previously studied methods for absorbing plastics tend to be expensive and difficult to make, limiting their scalability. Last year, researchers in Qingdao, Chinadeveloped a synthetic spongemade of starch and gelatin designed to remove microplastics from water, though its efficacy varied depending on water conditions. Related articleMicroplastics are in many of your body’s organs and tissues. Why they’re so bad and what you can do to stay healthier The low cost and wide availability of both cotton and squid bones mean the sponge created in Wuhan “has great potential to be used in the extraction of microplastic from complex water bodies,” according to the study. Shima Ziajahromi, a lecturer at Australia’s Griffith University who studies microplastics, called the squid-cotton-sponge method “promising” and said it could be an effective way to “clean up the high risk and vulnerable aquatic ecosystem.” However, the study’s authors did not address whether the sponge can remove microplastics that sink to the sediment, which is the majority of microplastics in our waters, said Ziajahromi, who was not involved in the study. Another “critical issue” is the proper disposal of the sponges, Ziajahromi said. “Although the material is biodegradable, the microplastics it absorbs need to be disposed of properly,” she said. “Without careful management, this process risks transferring microplastics from one ecosystem to another.” Ultimately, Ziajahromi added, minimizing plastic pollution is in the first place should remain a “top priority.”",Science
Penn State’s James Franklin wins a big one. More big ones are coming,https://www.cnn.com/2024/12/21/sport/james-franklin-penn-state-win-spt/,"By most measures of football success, James Franklin’s tenure at Penn State has been satisfying. A 100-41 record over 11 seasons, one Big Ten championship, a slew of players in the NFL. But there’s always been one question hanging over the Nittany Lions’ head coach: When was he going to win the big one? Aside from a victory over Wisconsin in the 2016 Big Ten championship game, Franklin’s Penn State teams often came up short on the biggest stages. In front of 106,031 raucous fans on Saturday,Franklin won one of those big ones in the school’s debut in the College Football Playoff. Now there are bigger stages with brighter lights looming. The Nittany Lions’ 38-10 victory over Southern Methodist University lacked dramatics once the home team started forcing turnovers and the din created by the Penn State faithful appeared to get to SMU quarterback Kevin Jennings. The Nittany Lions were simply more poised and took advantage of the Mustangs’ mistakes. That experience – in cold weather, in Beaver Stadium, in pressure games – paid off for the Nittany Lions. It led to a party in the stands that lasted most of the 60 minutes of Saturday’s game and will continue throughout the night in this scenic town tucked away in central Pennsylvania’s Appalachian Mountains – likely indoors after conditions in University Park that made the game feel every bit like it was taking place on the first day of winter. It was the kind of moment the Penn State community has been looking forward to for years. One of college football’s most intense fanbases, the Nittany Lions’ fans have cringed in recent years as the team has fallen just short of a College Football Playoff berth over and over. But Franklin wasn’t shy about reminding the press after the game about his track record. “We played in a bunch of them,” Franklin said about high-profile bowl games. “Dramatic pause, so everybody can take that in. We played in a bunch of them. My family, we’re used to spending Christmas in hotels. Not everybody is.” With the expanded playoff this season, PSU not only got into the field but won the right to host a home game. Thanks to the CFP rules, they’ve also now got a favorable quarterfinal matchup against Boise State University in the Fiesta Bowl on New Year’s Eve. It’s a place where Penn State feels comfortable – the program is 7-0 all-time in the desert. Any rumblings in Happy Valley over whether Franklin would be able to push this program to the heights the PSU community feels it deserves will likely quiet now. And there were rumblings –TNT Sports analysts Champ Bailey and Takeo Spikesbelieved Saturday’s game against SMU represented a must-win situation for Franklin. “When you look at all the prior years, Penn State would always finish anywhere from nine to 12 in the rankings,” Spikes toldCNN Sport. “This has been a high ranking to where they are now, and you’re fortunate enough to be able to get a home game. This is the thing that really puts a lot of pressure on these guys, especially Coach Franklin. When you look at where they’re slotted, they’re really slotted in a good chance … is really set up for them to have success.” Bailey put it much more succinctly. “He better win this game,” the Hall of Famer said. “This is it. … You gotta win this game. Yeah, his career might be on the line for this one, at least at Penn State.” That pressure is certainly lifted somewhat off Franklin and his staff. But he emphasized that he doesn’t see the win – a milestone 100th at Penn State – as being about him specifically. “I appreciate you bringing up the 100 wins and all that kind of stuff. But to me, I’m at a point in my career it’s all about the players. It’s all about the players, the staff, you know,” he said. Still, offensive coordinator Andy Kotelnicki said the win was a product of how Franklin has built the Penn State program – especially as Franklin just made history by winning the school’s first College Football Playoff game. “To speak of the tradition of this place, to have football as long as this place has had it, to have this state in the way it is, and to do something that’s never been done here – it’s pretty freakin’ rare. It’s pretty cool to be part of it,” he said. “Honestly, I feel like just a spoke in the flywheel that he’s created here. You know I’m the offensive coordinator, it’s an important position. But he doesn’t get enough credit for what he’s done here consistently, honestly.” Defeating a SMU team that was the last team into the playoff field isn’t enough for the longtime head coach of the Nittany Lions. There are still big questions about how Franklin’s teams perform under the brightest lights. At Penn State, Franklin is 1-18 against teams ranked in the top five – including a devastating 1-10 against archrival Ohio State. The former Vanderbilt head coach won’t be able to face another top five team until the semifinal round, should the Nittany Lions defeat the Broncos; both the University of Georgia and Notre Dame are ranked in the top five of the final College Football Playoff rankings. “I don’t care what anybody says about me or my team or my coach. At the end of the day, our process is our process, and at the end of the day, the only opinions that matter are the ones that are in the Lasch (Football) Building day to day,” said quarterback Drew Allar after the game. “… And in terms of, you know, Coach Franklin – he gets a lot of criticism that’s undeserved, and he’s done a lot, like, a lot more than people give him getting credit for. And obviously, winning, winning his 100th game is special. To be a part of that and be the team that you know is able to deliver that 100th team win to him, and to have it on the stage like the playoffs and at home in Beaver Stadium, it’s truly special. And, you know, we don’t take these moments for granted.” But behind a balanced offense – Penn State rushed for 189 yards and passed for 136 yards Saturday against SMU – and the nation’s sixth-ranked defense, Franklin has a squad that seems to be playing its best football at the right time of year. With the playoff weight successfully lifted off his shoulders, Franklin and Penn State certainly looked like a possible national champion Saturday afternoon. “A lot of college coaches I saw this week talking about, you know, this is a four-game season. It’s not. It was a one game season with an average of 65 plays on offense, 65 plays on defense, and 20 plays on special teams,” Franklin said. He added, “We just extended our season one more game. Sixty-five more plays. I think we got 10 days, or whatever it may be, (until the next game) and every one of them is like gold.”",Sports
‘World’s steepest’ cable car opens in Switzerland,https://www.cnn.com/2024/12/21/travel/travel-news-worlds-steepest-cableway-schilthorn/,"Editor’s note: Sign up forUnlocking the World, CNN Travel’s weekly newsletter. Get news about destinations, plus the latest in aviation, food and drink, and where to stay. It’s asolstice Saturdayin the Northern Hemisphere as December 21 is the shortest day of the year and the official first day of winter. Yes, that’s right. It’s only just begun. Cheer yourself up with our lasttravelnews roundup of 2024. A spectacular new cable car has opened in Switzerland’s Bernese Alps. The Schilthorn Cableway takes riders up to the mountaintop revolving restaurant made famous in the James Bond movie “On Her Majesty’s Secret Service.” Its makers say it’s thesteepest in the world, climbing 775 meters (2,543 feet) in just four minutes at a gradient of 159.4%. It connects the village of Stechelberg with the car-free village of Mürren, some 1,650 meters (5,413 feet) above sea level. The cableway hasn’t been recognized by Guinness World Records yet, but Switzerland is no stranger to high-altitude record-breakers. The world’ssteepest funicular railwayopened in the alpine village of Stoos in 2017, rising 743 meters (2,438 feet) along gradients as steep as 110%. If that’s not fearsome enough, there’s the Stanserhorn Cabrio in Lucerne. It’s the world’s first cable car to feature aroofless upper deck. Breezy. Four teenagers posed in miniskirts and flip-flops for a photo on a seaside vacation in England in 1972. More than 50 years later, this group of lifelong friends recreated it.Take a look here. A Polish girl and a Balkans boy met as teenagers in Greece in 2005. A mutual summer crush developed, but it never moved beyond friendship. Then he unexpectedly cameback into her life. A French man and a Canadian woman had a vacation romance in Cuba in 2016. He told her they’d “stay in touch.” She assumed she’d never hear from him again — then theFacebook requestpopped up. This month, a delayed flight stuck at Atlanta’s airport got unexpectedly festive when a US Army vet got his saxophone out and playedChristmas songs. Wayne Hoey, who played in the Army Band for two decades, even did a rendition of “Baby Shark” to soothe the toddlers on board. Holiday travel is often stressful, with or without a reed instrument on hand. CNN Travel asked flight attendants toshare their secretsfor getting from A to B through the season. There are plenty of European towns and cities that are magical at Christmas — here’sour pickof 11 of them — but one in particular is on top of many people’s wishlist. Tourism is booming in Rovaniemi, Lapland, home toSanta Claus village, but not everyone is happy about the deluge of visitors. The Unlocking the World newsletter is taking a little holiday break next week, too. We’ll be back with more travel news for you in 2025. Locals say this generations-old restaurant in the foothills of Mount Vesuvius makes the best pasta puttanesca in the world. The owner, Teresa Izzo, showed CNN the secret. If you’re looking for last-minute presents for the foodies in your life, our partners at CNN Underscored, a product reviews and recommendations guide owned by CNN, have this roundup of63 food giftsfor every budget. No cheeses for us meeces? There’ll be no festive dairy shortage on CNN Travel’s watch. Meet a woman whoinvents cheesesat her mountain hideaway. You can ski right across international borders on these mountains. No passport needed. These are the tourist attractions you won’t be able to visit in 2025. Why we can’t havenice things. The world’s busiest flight routes for 2024 have been revealed. Asia and the Gulf region aretop of the list.",World
"False rape allegations like the Duke scandal aren’t common enough to justify withholding support from victims, advocates say",https://www.cnn.com/2024/12/21/us/duke-lacrosse-rape-case-victims/,"When Katie Koestner was a college freshman, a boy she liked took her out to dinner. They went on a few more dates, she says, until one night, after going back to her college campus dorm, he ignored her pleas and raped her. Up until that point, Koestner was a quiet girl, who rarely spoke out to defend herself when she was mocked or taken advantage of. But this time, she found her voice. The dean of her university, The College of William & Mary in Virginia, steered her away from filing a police report, she says. The man she accused of assaulting her was found guilty in a university investigation but was allowed to stay on campus. For years, Koestner says, she faced backlash for going public with her story. Koestner and other sexual assault victim advocates are now issuing reminders of the dangers of dismissing and discrediting rape allegations in light of thelatest development in the 2006 Duke scandal. Related articleA timeline from accusation to admission: Crystal Mangum says she lied about Duke rape, turning a 2006 scandal on its head More than 18 years after accusing three now-former Duke University lacrosse players of raping her, an account she shared in graphic detail, Crystal Mangum admitted in an interview published Wednesday that she lied about the encounter. Mangum apologized to the men for fabricating a story in which she said she wastrapped inside a bathroom, sexually assaulted and raped by three players at a team party where she was performing as an exotic dancer. The men werearrestedfollowing her allegations. “This was a really damaging instance that hurt those boys’ lives and impacted them for decades, so I don’t want to downplay how tragic it is from that perspective, but I do hope that people put it into context of this is far from the norm,” says Scott Berkowitz, president of non-profit anti-sexual violence organization Rape, Abuse & Incest National Network (RAINN). “For every false report, there is a far greater number of reports both that are truthful and people who experienced rape who never reported. That’s a much bigger national problem.” A study published by the journalViolence Against Womenin 2010 found that false allegations of sexual assault range from between 2% to 10% of assaults reported. A majority of sexual assaults, an estimated 63%, are never reported to the police, according to theNational Sexual Violence Resource Center. “Crystal’s case was a high-profile case so many people might hear just about her case and a few others, and then misperceive the amount of false reports to be much higher than it really is,” Koestner, who is now the founder of anti-sexual violence nonprofitTake Back The Night, told CNN. “We should take each case as one situation and not make assumptions about those involved. The Duke case is one of millions. I hear about 10 stories from victims each day I speak at a school — no matter whether it is Princeton or a public high school in Texas.” Rare cases like the Duke scandal, victims’ advocates like Koestner say, might discourage victims from reporting sexual assault and cause people to wrongly doubt them. “False reports hurt not only the people falsely accused, they hurt every rape victim,” Jennifer Simmons Kaleba, vice president of communications for RAINN, told CNN. “There are already too many victims who do not report the crime for fear of not being believed. After a false report in such a high-profile case, even more survivors may be reluctant to come forward out of fear that law enforcement will not believe them.” Survivors of sexual assault and rape often grapple with a range of fears when considering whether to report the crime. Many worry they won’t be believed, that law enforcement won’t take their case seriously, or that their personal history will be used against them. Others are concerned about professional repercussions, having their motives questioned, seeing their reputations tarnished, and losing their privacy. “False reports like this case really exacerbate that problem,” Berkowitz told CNN. Experts say it is crucial for the mental health and recovery of rape victims to feel comfortable reporting their assault and getting help. Victims who have supportive friends and family will have a much better, quicker road to healing, Berkowitz says. The safety of both communities and society as a whole is also dependent on victims reporting their assaults, ensuring that perpetrators are held accountable and prosecuted. “From a justice standpoint, a really significant percentage of rapists are serial criminals, and so when someone reports it and there’s a prosecution, it will statistically better prevent rapes in the future and protect others from being sexually assaulted,” Berkowitz said. Many victims keep the trauma to themselves and don’t even tell those closest to them what happened, which can have a significant long-term impact on their health. Many survivors often struggle with post-traumatic stress disorder (PTSD) for years after the assault, Berkowitz said. Rape victims are also significantly more likely to later have drug- and alcohol-related problems and experience mental health issues like depression and anxiety. Rape victims are 13 times more likely than non-crime victims to attempt suicide, according to a study by theNational Violence Against Women Prevention Research Center. “Rape is very similar to other types of trauma and the effects that it has on someone,” Berkowitz said. “It’s not something that anyone ever forgets or completely moves past, but we want to see victims heal to a point where they can continue living their lives and continue to devote the time to family and to work as they as they should be.” Victims can receive mental health support from resources including theNational Sexual Assault hotlineor from professional therapists. Those who have friends and family who believe them and are there for them as they navigate through the recovery process also have better chances at recovery, Berkowitz said. Koestner was 18 when she was on the cover ofTime magazinein 1991 as one of the first women to publicly speak out about being a victim of date rape – sexual assaults in which there was a form of romantic relationship between the victim and assailant. “My assaulter was found guilty in my campus hearing and told not to go in my dorm for a semester as his punishment. It was the lack of accountability that caused me to speak out,” Koestner said. “That led to more interviews and helped me let others know that rape can happen to anyone.” Thousands of students signed a petition alleging she lied. Her car was covered with honey and baby powder, she was voted “the most dangerous man on campus,” and derogatory words were written about her on the walls of some women’s bathrooms on campus – but still, she was not silenced. “Speaking out about what happened helped me turn the trauma into a purpose: raising awareness of any problem is the first step toward prevention,” Koestner said. The College of William & Mary later changed its policy to require school officials to suspend students found guilty of sexual assault. There are more than 433,000 cases of sexual assault or rape annually in the US among people aged 12 and older,according to 2015 data from RAINN. Every 68 seconds, another American is sexually assaulted, RAINN data from 2020 shows. Kaleba said she encourages people to consider the victims of rape or sexual assault in the USwho may now face renewed disbelief and question the value of reporting sexual violence. “Don’t allow infrequent, false reporting to stand in the way of standing with survivors,” Kaleba said. Editor’s note: Anyone affected by sexual violence can reach out to the National Sexual Assault Hotline at 800-656-HOPE (4673) or visit online.rainn.org to receive support via confidential online chat.",Society
‘Captain America’ rescued from Colorado highway,https://www.cnn.com/colorado-captain-america-gnojek/,"Sometimes even superheroes need rescuing. A Colorado deputy came to the aid of “Captain America” after the crusader’s motorcycle broke down en route to a local children’s hospital event last Wednesday. Matt Gnojek, dressed as the Avenger and known locally asColorado Captain, had planned to make an appearance at the hospital’s holiday parade when an engine failure left him stranded on the highway shoulder just south of Denver. Enter Douglas County Sheriff’s Deputy Zach Zepeski who came upon Gnojek while out on patrol. “I just wanted him to focus on being safe,” Zepeski told CNN. Gnojek told the deputy his insurance didn’t cover the cost of a tow and mentioned he was in contact with a friend to secure a ride. Intrigued by the costume and Gnojek’s “military-style” motorcycle, Zepeski asked where the superhero was headed. When he learned of Gnojek’s destination,  Zepeski jumped into action. Part of the encounter was caught onbody camera footagereleased by the Douglas County Sheriff’s Office. Zepeski offered to pay for the cost of the tow and waited for the truck to arrive ensuring the motorcycle was moved to a safe location while Gnojek and his friend made arrangements to pick up the vehicle. “I’ve been to a couple of those parades for the kids and seeing the smiles on their faces … is just amazing,” Zepeski said. “He is doing this out of the goodness of his heart, he just wants to make people smile, and if I can do anything to help with that, that’s all I needed.” Although Gnojek ultimately missed the parade, he has since participated in several other events, including the “Shop with a Cop” weekend event organized by Zepeski’s sheriff’s office. The event provided lower income children with gift cards to shop for holiday presents. “I couldn’t be more grateful to (Zepeski) – thanks to him I get to go and do all these events and visit the kids and rally more people to the cause,” Gnojek told CNN. Colorado Captain, Gnojek’s superhero persona, raises funds for families battling pediatric cancer through theCap for Kidsorganization. He also visits hospitals, refugee centers and veteran events, Gnojek said. Zepeski’s act of kindness earned praise on social media, with some usersofferingto help cover the towing costs. Zepeski declined those offers. “I hope that rather than paying me back, they donate to (Colorado Captain) or to any sort of children’s fund or charity that they find in their heart they want to donate to,” he said.“I’d much rather have it go to them than to me.”",Society
