headline,link,content,category
"The president-elect has railed against the policy, which is protected by the 14th Amendment. How his allies plan to end it.",https://www.cnn.com/2024/12/22/politics/birthright-citizenship-trumps-plan-end/,"President-elect Donald Trump’s team is assessing multiple options to fulfill his long-promised pledge to end birthright citizenship, according to two sources familiar with the discussions, teeing up a legal fight with the expectation that the Supreme Court would ultimately have to rule on the matter. Trump has railed against birthright citizenship, which is protected by the 14th Amendment, for yearsand suggested he’d use executive action to ban it. “We’re gonna have to get it changed, or maybe I would go back to the people, but we have to end it. We’re the only country that has it,” Trump toldNBC’s Kristen Welker,echoing a false statementhe’s made in the past. “If we can, through executive action. I was going to do it through executive action, but then we had to fix Covid first, to be honest with you.” In private, his allies have been crafting strategies to do that, including directing the State Department to not issue passports to children with undocumented parents and tighten requirements for tourist visas to crack down on “birth tourism,” according to two sources familiar with the planning. Multiple options are being kicked amongTrump allies to tighten the interpretation, keenly aware that any action would likely get legally challenged and eventually land before the Supreme Court. “Something has to kick off the legal battle,” one of the sources told CNN. The Trump transition pointed to Trump’s comments to Welker when asked for comment. Trump allies argue that the 14th Amendment has been misinterpreted and doesn’t apply to children born in the United States to undocumented parents. Some immigration hardliners have argued that children of undocumented immigrants are not “subject to the jurisdiction” of the US and shouldn’t be consideredcitizens under the Constitution. About three dozen countriesprovide automatic citizenship to people born on their soil, including US neighbors Canada and Mexico and the majority of South American countries. There are about 4.4 million US-born children under 18 who live with an undocumented parent,according to the Pew Research Center. “This isn’t a barn-burning emergency. This doesn’t have to be done and completed and set in stone in year one. They know they’re going to the Supreme Court with it, and they’ll methodically make their case,” said another source familiar. A legal fight would be inevitable, but getting the Supreme Court to take up such a challenge is not a guarantee, and the high court will be less inclined to do so if there is no disagreement among the circuits about the meaning of birthright citizenship. But if the Trump administration brings the dispute to the court’s emergency docket, asking for the high court to pause a lower court order blocking the policy, the justices will have to take some sort of action. If the Supreme Court does take up a full review of the case, it could also duck the central constitutional questions by ruling against Trump based on the statute guaranteeing birthright citizenship instead. “I don’t think it’s likely, but it’s an offramp if they wanted it,” said Steve Vladeck, a CNN legal analyst and professor at the Georgetown University Law Center. The strategizing by the Trump team to try to end birthright citizenship has been matched by the preparations made by those who would challenge the move in court. “We expect to sue, and others will as well,” said Cody Wofsy, the deputy director of the ACLU Immigrants’ Rights Project. “We have been very focused on what we’re going to do in this scenario and we’re ready to go.” Supporting the case for affirming birthright citizenship is in both the Constitution’s 14th Amendment, which says that “all persons born or naturalized in the United States, and subject to the jurisdiction thereof, are citizens of the United States,” and similar statute with origins that predate the constitutional provision. Longstanding Supreme Court precedents are also a major hurdle for the incoming Trump administration. An 1898 Supreme Court ruling upheld the amendment’s application to those born on US soil whose parents are noncitizens, while a 1982 case made clear that the amendment also applied to children who born to undocumented immigrants. “The history is clear. The constitutional text here is clear. The longstanding precedent is clear,” Wofsy said. “So, we are confident that, at the end of the day, the Constitution will prevail and people who are born here will continue to be recognized as US citizens.” Democratic attorneys general are eager to get into the fight as well. New JerseyAttorney General Matthew Platkin pointed to how the proposal could affect his wife, a daughter of Chinese immigrants who was born in Philadelphia. California Attorney General Rob Bonta said Trump’s arguments for ending the right were “typical outlier extremist type of argument” that “won’t fly.” “We are definitely going to be suing him in court if there’s an attempt to deport US citizens,” he told CNN. Legal experts remain confident that birthright citizenship will remain even with a right-leaning Supreme Court that has shown willingness to overturn longstanding precedents on other issues, such as on abortion rights or regulatory power. Hiroshi Motomura, a scholar of immigration and citizenship at University of California, Los Angeles School of Law, said a Supreme Court reversal of the 1898birthright citizenship ruling would be “quite different” and “far more radical” than how the conservative majority has overturned other precedents like Roe v. Wade. “It really goes to how the nation sees itself and how it defines itself as a democracy,” Motomura told CNN, “The 14thAmendment and its interpretation comes out of history of being a nation and recognizing that to populate the nation and to settle the nation, you needed to give membership to people who were born in this country.”",Politics
6 key lines from Trump’s Sunday speech to conservative activists,https://www.cnn.com/2024/12/22/politics/trump-turning-point-rally-key-lines/,"President-elect Donald Trump on Sunday, in his first rally-like speech since the November election, threatened to retake control of the Panama Canal, pushed back on criticism of Elon Musk’s influence, and suggested he could soon meet with Russian President Vladimir Putin. Trump’s speech in Phoenix, at a Turning Point USA gathering of conservative activists celebrating his victory last month, largely echoed the rhetoric he used on the campaign trail — including lies about widespread fraud in the 2020 election — but were tempered with his satisfaction at having won. “We had no riots. We had no anything. It was a beautiful thing to watch,” Trump said, noting Democrats’ concession of the 2024 election. “They just said, ‘We lost.’ And we want to try bringing everybody together.” Trump did not address the chaotic past week in Washington, which saw him play a central role in scuttling a House short-term government funding deal with a last-minute declaration of his opposition — and a ferocious social media campaign led by Musk against it. Their opposition set off a scramble that led lawmakers toapprove a different short-term measure, without the debt ceiling suspension Trump had demanded, to avert a government shutdown. Instead, Trump vowed to keep the promises he made on the campaign trail and to take action on his firsts day in office on, among other things, immigration, energy production and a series of culture war issues. Here are six key lines from Trump’s speech on Sunday: Trump said he would consider retaking control of the Panama Canal, which he referred to as a “vital national asset,” doubling down on social media posts he’d made on the topic Saturday. “Our Navy and commerce have been treated in a very unfair and injudicious way. The fees being charged by Panama are ridiculous, highly unfair, especially knowing the extraordinary generosity that has been bestowed to Panama — I say, very foolishly, by the United States,” Trump said. “This complete rip-off of our country will immediately stop.” It was a demonstration of how the United States’ approach to foreign policy could shift under Trump, who has shown a willingness to use bellicose rhetoric — even toward allies — to accomplish his goals. He’s threatened 25% tariffs, for example, on Canada and Mexico on day 1 of his administration. The Panama Canal, which links the Atlantic and Pacific oceans, is a vital passage for American commerce that was built principally by the United States and opened in 1914. President Jimmy Carter signed a treaty that began the process of transferring control of the canal to Panama in 1977, and that transfer was finalized in 1999. “It was given to Panama and to the people of Panama, but it has provisions — you’ve got to treat us fairly. And they haven’t treated us fairly,” Trump said. “We will demand that the Panama Canal be returned to the United States of America in full, quickly and without question. I’m not going to stand for it. So to the officials of Panama, please be guided accordingly.” Panama’s President José Raúl Mulino stated in a video message Sunday afternoon that the Canal and its adjacent zone belong to Panama. “The sovereignty and independence of our country are not negotiable,” Mulino said ina statement posted on X, pointing to the 1977 treaty. “Panama respects other nations and demands respect. With the new government of the United States, I aspire to preserve and maintain a good and respectful relationship,” he added. “Security issues such as illegal migration, drug trafficking and organized crime should be a priority on our bilateral agenda, as they are a real threat that should concern us,” Mulino said. Trump suggested he could meet with Putin early in his presidency as he seeks to negotiate an end to Russia’s war in Ukraine. Trump said bringing the war to an end is “one of the things I want to do quickly,” and said Putin wants to meet with him “as soon as possible.” “So we have to wait for this. But we have to end that war,” Trump said. During Putin’s year-end media availability last week, he said he’s “ready” for potential talks with Trump. Trump pushed back on Democrats’ characterization of Musk as acting as the de facto president, after Musk — who has spent much time with Trump at Mar-a-Lago since the president-elect’s victory — helped tank the bipartisan government funding bill last week. “No, he’s not taking the presidency. I like having smart people,” he said. “They’re on a new kick. ‘Russia, Russia, Russia,’ ‘Ukraine, Ukraine, Ukraine,’ all the different hoaxes. The new one is ‘President Trump has ceded the presidency to Elon Musk.’ No, no, that’s not happening.” Trump went on to praise Musk’s company, SpaceX, for making advancements in space travel and for its Starlink satellite technology, but again reiterated that Musk is “not going to be president.” “No, he’s not going to be president, that I can tell you,” he said. “And I’m safe, you know why? He can’t be — he wasn’t born in this country.” Former President Barack Obama’s administration renamed the highest mountain peak in North America, Mount McKinley, to Denali to honor Alaska’s native population, which had used the name for centuries. Trump arrived at the topic after crediting President William McKinley with spurring the economic prosperity that allowed President Theodore Roosevelt’s administration to begin construction of the Panama Canal. Trump said McKinley should have his name restored because he was a “great president” who “deserves it.” “McKinley was a very good, maybe a great president. They took his name off Mount McKinley. That’s what they do to people,” Trump said. “President McKinley was the president that was responsible for creating a vast sum of money,” he said. “That’s one of the reasons that we’re going to bring back the name of Mount McKinley, because I think he deserves it.” Trump also said he would restore the names of military bases like North Carolina’s Fort Bragg, the former name of what’s now Fort Liberty. The name was changed in 2023 to strip the military base of its Confederate namesake. “Woke has to stop. Because along with everything else, it’s destroying our country. We’re going to stop woke,” Trump said. “Woke is bullsh*t.” Trump defended his controversial pick for Health and Human Services secretary, Robert F. Kennedy Jr. — and seemed to suggest he would allow Kennedy to probe for links between vaccines and autism, despite no evidence supporting the connection that Kennedy has long claimed exists. Trump pointed to rises in diagnoses of autism, childhood cancer and chronic diseases, and said that “something’s wrong.” “Together, we’re going to make America healthy again,” Trump said. “Something bad is happening.” Kennedy’s long history of vaccine skepticism has been a source of focus for some Republican senators who are meeting with Trump’s Cabinet nominees ahead of confirmation hearings. Both Kennedy and Trump have in recent weeks sought to address those concerns — with Trump at a recent news conference describing himself as a “a big believer in the polio vaccine” and Kennedy saying he’s “all for” the vaccine. Still, at the same news conference, Trump similarly noted higher autism rates, and said he wants Kennedy to “come back with a report as to what he thinks. We’re going to find out a lot.” Trump again expressed openness to allowing the social media app TikTok to continue operating in the United States, suggesting that the app may have helped reach some key voters. His comments come as the Supreme Courtlast week agreed to decidewhether a controversial ban on the social media app violates the First Amendment. The high court agreed to expedite the case and hear arguments on January 10. Trump touted his popularity on the app and the gains he made with young voters in the 2024 election, saying he is “going to have to start thinking about TikTok.” “We did go on TikTok, and we had a great response. We had billions and billions of views,” he said. Trump said he was shown a chart highlighting the views his campaign had received there. “As I looked at it I said, ‘Maybe we gotta keep this sucker around for a little while,’” he said.",Politics
